{
  "schema_version": "1.1.0",
  "event_id": "11111111-1111-4111-8111-111111111111",
  "event_name": "qr_scan_start",
  "ts_ms": 1734203000123,
  "tenant_id": "11111111-1111-4111-8111-111111111110",
  "session_id": "sess_001",
  "event_meta": {
    "app_channel": "kiosk",
    "platform": "kiosk",
    "app_version": "2.6.1",
    "sdk_version": "1.1.0"
  },
  "payload": {}
}
